Index,Source,Author,Title,Description,Content,Headline Sentiment,Offense Rating,Negative Words,Offensive Words,Tags,publishedAt,url,urlToImage
60,Autoblog,Byron Hurd,2023 Mercedes-Benz EQE 350+ Road Test: Reimagining the Mercedes midsize sedan,"Filed under:
 Green,Mercedes-Benz,New Car Reviews,Electric,Luxury,Sedan,Road Tests
 Continue reading 2023 Mercedes-Benz EQE 350+ Road Test: Reimagining the Mercedes midsize sedan
2023 Mercedes-Benz EQE 350+ Road Test: Reimagining the Mercedes midsize sedan or…",DETROIT What comes out the other side when Mercedes-Benz chucks a well-established midsize luxury sedan nameplate into its magical EV converter? Take one look at the 2023 EQE sedan and you know right… [+8421 chars],Very Positive,20,[],[],['Filed'],2023-03-08T11:00:00Z,https://www.autoblog.com/2023/03/08/mercedes-eqe-350-road-test/,https://o.aolcdn.com/images/dims3/GLOB/legacy_thumbnail/1062x597/format/jpg/quality/100/https://s.aolcdn.com/os/ab/_cms/2022/09/27112547/2023-Mercedes-Benz-EQE-500-Sedan-12.jpg
61,Autoblog,Jeremy Korzeniewski,Best used cars to buy in 2023,"Filed under:
 Green,Car Buying,Used Car Buying,Truck,Convertible,Coupe,Crossover,Hatchback,SUV,Wagon,Economy Cars,Electric,Hybrid,Off-Road Vehicles,Performance,Sedan
 Continue reading Best used cars to buy in 2023
Best used cars to buy in 2023 originally appe…","Car and truck buyers, as were sure youve noticed, are increasingly being priced out of the new vehicle market as every month seems to set a new record for average transaction prices. The good news, t… [+18814 chars]",Very Positive,20,[],[],"['GreenCar', 'VehiclesPerformanceSedan', 'Filed']",2023-03-24T10:00:00Z,https://www.autoblog.com/article/best-used-cars-to-buy/,https://o.aolcdn.com/images/dims3/GLOB/legacy_thumbnail/1062x597/format/jpg/quality/100/https://s.aolcdn.com/os/ab/_cms/2023/03/23152746/inflation.jpeg
62,Autoblog,Insider,EVs don't need as much maintenance: Here are key differences,"Filed under:
 Government/Legal,Green,Electric
 Continue reading EVs don't need as much maintenance: Here are key differences
EVs don't need as much maintenance: Here are key differences originally appeared on Autoblog on Mon, 13 Mar 2023 15:17:00 EDT. Please …","EV drivers can say goodbye forever to oil changes and various other common gas-drivetrain maintenance responsibilities. Tesla has advertised its vehicles with that, touting them as ""eliminating the n… [+4686 chars]",Neutral,30,['Mar'],[],"['13', 'Autoblog', 'on', 'Filed', 'Mon']",2023-03-13T19:17:00Z,https://www.autoblog.com/2023/03/13/electric-cars-evs-dont-need-as-much-maintenance/,https://o.aolcdn.com/images/dims3/GLOB/crop/1440x810+0+149/resize/800x450!/format/jpg/quality/85/https://media.zenfs.com/en/insider_articles_922/dfb2a1ead0e17aa7e9cd65de8f4e3757
63,Autoblog,Zac Palmer,2023 Volvo XC40 and XC40 Recharge Review: Gas or electric? You can’t go wrong,"Filed under:
 Green,Volvo,Buying Guide,New Car Reviews,Crossover,SUV,Electric,Hybrid,Luxury
 Continue reading 2023 Volvo XC40 and XC40 Recharge Review: Gas or electric? You can’t go wrong
2023 Volvo XC40 and XC40 Recharge Review: Gas or electric? You can’t go…","Pros: Cute and functional design; efficient powertrains; a good overall value
Cons: Recycled materials can feel cheap; Recharge has average EV range; doesnt qualify for federal EV tax credit
The 20… [+11076 chars]",Very Negative,230,['wrong'],[],"['Recharge', 'Review', 'Continue', 'Gas', 'GreenVolvoBuying', 'Filed', 'Car', 'GuideNew', 'Volvo', 'ReviewsCrossoverSUVElectricHybridLuxury']",2023-03-01T13:45:00Z,https://www.autoblog.com/article/2023-volvo-xc40-and-xc40-recharge-review/,https://o.aolcdn.com/images/dims3/GLOB/legacy_thumbnail/1062x597/format/jpg/quality/100/https://s.aolcdn.com/os/ab/_cms/2023/02/24123542/IMG_93143.jpg
64,Autoblog,Reuters,Scratched EV battery? Your insurer may have to junk the whole car,"Filed under:
 Green,Tesla,Auto Repair,Insurance,Electric
 Continue reading Scratched EV battery? Your insurer may have to junk the whole car
Scratched EV battery? Your insurer may have to junk the whole car originally appeared on Autoblog on Mon, 20 Mar 2023 …","Damaged electric vehicles that have been written off by insurers are lined up at UK salvage company Synetiq's yard in Doncaster, Britain. (Reuters)
LONDON/DETROIT For many electric vehicles, there i… [+7942 chars]",Very Negative,270,"['Scratched', 'junk', 'Mar']",[],"['EV', 'Autoblog', 'Scratched', 'on', 'Filed', '20', 'Mon']",2023-03-20T16:14:00Z,https://www.autoblog.com/2023/03/20/ev-battery-packs-insurers-junk-entire-car/,https://o.aolcdn.com/images/dims3/GLOB/crop/5472x3078+0+486/resize/800x450!/format/jpg/quality/85/https://s.aolcdn.com/os/ab/_cms/2023/03/20121304/2023-03-20T132258Z_3_LYNXMPEJ2J050_RTROPTP_4_AUTOS-ELECTRIC-INSURANCE.jpg.jpg
65,Autoblog,Lawrence Ulrich,Genesis' decision to build the Electrified GV70 in America is a sign of things to come,"Filed under:
 Government/Legal,Green,Plants/Manufacturing,Genesis,Hyundai,Kia,Car Buying,Crossover,SUV,Electric,Luxury
 Continue reading Genesis' decision to build the Electrified GV70 in America is a sign of things to come
Genesis' decision to build the Elec…","As Steely Dan famously sang, they call Alabama the Crimson Tide. Here in Montgomery, were knee-deep in a Green Tide thats transforming the business of building and selling cars. The high-style Genesi… [+7228 chars]",Very Positive,80,[],[],"['Genesis', 'decision', 'America', 'Filed']",2023-03-21T16:05:00Z,https://www.autoblog.com/2023/03/21/genesis-electrified-gv70-alabama-america-ira-ev-tax-credit/,https://o.aolcdn.com/images/dims3/GLOB/legacy_thumbnail/1062x597/format/jpg/quality/100/https://s.aolcdn.com/os/ab/_cms/2023/03/21114719/GV70.Electrified1458.jpg
66,Autoblog,Zac Palmer,"Best small SUVs of 2023: Compact, midcompact and subcompact","Filed under:
 Car Buying,Best Cars,Crossover,Hatchback,SUV,Electric,Hybrid,Off-Road Vehicles
 Continue reading Best small SUVs of 2023: Compact, midcompact and subcompact
Best small SUVs of 2023: Compact, midcompact and subcompact originally appeared on Autob…","It seems like such a simple question, right? What is the best small SUV? Really, we'd love to provide a simple answer. Buy the _______! Unfortunately, it's just not that simple, though we'll at least… [+16327 chars]",Very Positive,20,[],[],['Filed'],2023-03-02T13:00:00Z,https://www.autoblog.com/article/best-small-suvs/,https://o.aolcdn.com/images/dims3/GLOB/legacy_thumbnail/1062x597/format/jpg/quality/100/https://s.aolcdn.com/os/ab/_cms/2023/03/01120717/Small-SUVS-collage-22823.jpg
67,Penny-arcade.com,nan,12 Hours of Sebring!,Now that my body is handling VR much better I am back into sim racing in a big way. I had been using an ultrawide monitor for my racing display but VR is SO much better! My lap times are more than 5 seconds faster in some cases. That’s huge when winners and l…,Now that my body is handling VR much better I am back into sim racing in a big way. I had been using an ultrawide monitor for my racing display but VR is SO much better! My lap times are more than 5 … [+1628 chars],Very Positive,0,[],[],['VR'],2023-03-20T23:35:00Z,https://www.penny-arcade.com/news/post/2023/03/20/12-hours-of-sebring,https://assets.penny-arcade.com/img/logo_opengraph.jpg
68,MarketWatch,Sabela Ojea,Dow Jones Newswires: ON Semiconductor signs long-term EV supply deal with BMW,ON Semiconductor Corp. has secured a long-term agreement with BMW AG to support the German car-maker's electric vehicles.,"ON Semiconductor Corp. 
 ON,
 -1.94%
has secured a long-term agreement with BMW AG 
 BMW,
 -0.02%
to support the German car-makers electric vehicles.
The semiconductor manufacturing companys E… [+93 chars]",Very Positive,40,[],['German'],"['BMW', 'ON', 'Corp.', 'Semiconductor', 'AG']",2023-03-07T01:09:00Z,https://www.marketwatch.com/story/on-semiconductor-signs-long-term-ev-supply-deal-with-bmw-ce2b3475,https://mw3.wsj.net/mw5/content/logos/mw_logo_social.png
69,AppleInsider,news@appleinsider.com (Nathaniel Pangaro),Wired CarPlay vs. wireless - the pros and cons,"Apple offers a wired and wireless version of CarPlay, and while each version offers a near-identical experience from your iPhone, there are pros and cons to each. Here are the pros and cons of both.Apple's CarPlay has been a feature on iPhone for the past dec…","AppleInsider may earn an affiliate commission on purchases made through links on our site.
Apple offers a wired and wireless version of CarPlay, and while each version offers a near-identical experi… [+12554 chars]",Very Positive,110,['cons'],['pros'],"['Apple', 'CarPlay']",2023-03-02T19:41:01Z,https://appleinsider.com/inside/carplay/vs/wired-carplay-vs-wireless---the-pros-and-cons,https://photos5.appleinsider.com/gallery/53085-106306-IMG_2655-xl.jpg
70,Cheezburger.com,"bradpdickson, bradpdickson",'AITA for not giving my boss my first class seat?': Internet defends worker's decision not to give their boss their personal seat upgrade,"If you haven't heard the word: It's 2023, and we're reinstating the law that entitles your lord to anything you own.
How dare you own something nicer than your boss? From now on, if they want your stuff, they get it…. That 10-year-old BMW you're driving? Han…","If you haven't heard the word: It's 2023, and we're reinstating the law that entitles your lord to anything you own.
How dare you own something nicer than your boss? From now on, if they want your s… [+717 chars]",Very Negative,220,[],[],"['BMW', 'law']",2023-03-07T23:00:00Z,https://cheezburger.com/19595013/aita-for-not-giving-my-boss-my-first-class-seat-internet-defends-workers-decision-not-to-give-their,https://i.chzbgr.com/original/19595013/hFF078034/stories-work-stories-toxic-workplace-manager-toxic-boss-managers-workplace-reddit-19595013
71,CNET,Nick Wolny,The Only Millennial Millionaires Anyone Likes Anymore - CNET,"After hustling to achieve financial independence in their twenties, Rhianna and Jon Schoeller now want to give their daughter the childhood they never had.","Who wants to be a millionaire? These days, just about everyone.
As such, the personal finance advice industry is more crowded than ever before. Aspiring influencers often lead the way with promises … [+10120 chars]",Very Negative,190,[],[],"['Rhianna', 'Schoeller', 'Jon']",2023-03-16T17:59:00Z,https://www.cnet.com/personal-finance/the-schoeller-family/,https://www.cnet.com/a/img/resize/c6e94a42442b79fae0d146b41e1e79bf8a503253/hub/2023/02/14/79570c51-4b25-48bf-9fb3-6f79721c78ee/cash-money-stack-100s-yellowblue-grid.png?auto=webp&fit=crop&height=630&width=1200
72,Yanko Design,Gaurav Sood,BMW CE 04 Vagabund Moto Concept for Gen-Z has storage for hauling a surfboard,BMW CE 04 Vagabund Moto Concept for Gen-Z has storage for hauling a surfboardGraz-based automotive design motorheads at Vagabund Moto like BMW bikes as their preferred choice as the starting point. The custom BMW R nineT and custom...,Graz-based automotive design motorheads at Vagabund Moto like BMW bikes as their preferred choice as the starting point. The custom BMW R nineT and custom BMW R100R created by them gravitated enough … [+2290 chars],Positive,0,[],[],"['BMW', 'CE']",2023-03-03T00:30:39Z,https://www.yankodesign.com/2023/03/02/bmw-ce-04-vagabund-moto-concept-for-gen-z-has-storage-for-hauling-a-surfboard/,https://www.yankodesign.com/images/design_news/2023/03/bmw-ce-04-vagabund-moto-concept-for-gen-z-has-storage-for-hauling-surfboard/BMW-CE-04-Vagabund-Moto-Concept-7.jpg
73,Yanko Design,Sarang Sheth,This BMW Scrambler concept was envisioned in both ICE and E-bike versions,"This BMW Scrambler concept was envisioned in both ICE and E-bike versionsProportionally different from the scramblers we’ve seen in the past, the BMW G7 Scrambler concept has a commanding aesthetic with a Z-shaped frame, a bottom-heavy...","Proportionally different from the scramblers we’ve seen in the past, the BMW G7 Scrambler concept has a commanding aesthetic with a Z-shaped frame, a bottom-heavy design, a cantilever seat, and a hea… [+1441 chars]",Very Positive,0,[],[],"['BMW', 'Ebike', 'ICE', 'Scrambler']",2023-03-16T22:30:39Z,https://www.yankodesign.com/2023/03/16/this-bmw-scrambler-concept-was-envisioned-in-both-ice-and-e-bike-versions/,https://www.yankodesign.com/images/design_news/2023/03/this-bmw-scrambler-concept-was-envisioned-in-both-ice-and-e-bike-versions/bmw_g7_scrambler_1.jpeg
74,Yanko Design,Sarang Sheth,This BMW M1 redesign brings the iconic supercar into the modern age with a cutting-edge aesthetic,"This BMW M1 redesign brings the iconic supercar into the modern age with a cutting-edge aestheticTouted as one of the rarest models BMW has ever built, the M1 is the German marque’s sole supercar dating back to the 70s. It...","Touted as one of the rarest models BMW has ever built, the M1 is the German marque’s sole supercar dating back to the 70s. It hasn’t been recreated since, and BMW pretty much never made a supercar ag… [+2572 chars]",Very Positive,40,[],['German'],['BMW'],2023-03-18T11:40:44Z,https://www.yankodesign.com/2023/03/18/this-bmw-m1-redesign-brings-the-iconic-supercar-into-the-modern-age-with-a-cutting-edge-aesthetic/,https://www.yankodesign.com/images/design_news/2023/03/auto-draft/bmw_m1_1.jpg
75,Yanko Design,Gaurav Sood,Marvel superheros and supervillains get their custom speedsters in this mystic AI-generated universe,Marvel superheros and supervillains get their custom speedsters in this mystic AI-generated universeMidjourney is all over the internet with renders of unrelated stuff created using the platform. Earlier we had the mashup of famous architects and their...,"Midjourney is all over the internet with renders of unrelated stuff created using the platform. Earlier we had the mashup of famous architects and their unique luxury cars, now popular superheroes an… [+1720 chars]",Very Positive,0,[],[],['AIgenerated'],2023-03-19T23:30:07Z,https://www.yankodesign.com/2023/03/19/marvel-superheros-and-supervillains-get-their-custom-speedsters-in-this-mystic-ai-generated-universe/,https://www.yankodesign.com/images/design_news/2023/03/marvel-superheros-and-supervillains-get-their-custom-speedsters-in-this-mystic-ai-generated-universe/Marvel_Spideman_AI_Generated_Car-1.jpg
76,Yanko Design,Sarang Sheth,The Buell brand gets a revival with this gorgeous Cyberpunk electric concept,"The Buell brand gets a revival with this gorgeous Cyberpunk electric conceptMeet the Buell XBE, a fan-made revival of the popular Harley Davidson subsidiary that shut shop in 2009, but never left our hearts. Combining a...","Meet the Buell XBE, a fan-made revival of the popular Harley Davidson subsidiary that shut shop in 2009, but never left our hearts. Combining a little of Buell’s rich automotive legacy with the newly… [+1771 chars]",Very Positive,0,[],[],"['XBE', 'Davidson', 'Buell', 'Harley']",2023-03-13T22:30:21Z,https://www.yankodesign.com/2023/03/13/the-buell-brand-gets-a-revival-with-this-gorgeous-cyberpunk-electric-concept/,https://www.yankodesign.com/images/design_news/2023/03/auto-draft/buell_xbe_1.jpg
77,Windows Central,zacharylboddy@outlook.com (Zachary Boddy),Forza Horizon 5 embraces the darkness with 'Midnights at Horizon' Series update,"Find your dark side in the 'Midnights at Horizon' Series update for Forza Horizon 5, which brings lots of nighttime challenges and events, as well as four new cars.","<ul><li>Forza Horizon 5 is a live service, open-world racing game from Playground Games and Xbox Game Studios.</li><li>On Monday, the studio announced Series 19 ""Midnights at Horizon,"" the next Serie… [+3691 chars]",Very Positive,10,['dark'],[],"['Horizon', 'Forza', '5']",2023-03-27T19:21:12Z,https://www.windowscentral.com/gaming/forza-horizon-5-embraces-the-darkness-with-midnights-at-horizon-series-update,https://cdn.mos.cms.futurecdn.net/3VaEJGX3N9LLaeomc5pZhT-1200-80.jpg
78,Uncrate.com,Uncrate,Barn Find 1972 BMW 3.0 CS,"The E9 coupe helped cement BMW's reputation as ""The Ultimate Driving Machine"". Produced from 1968 to 1975, the E9 formed the basis for the 3.0 CSL ""batmobile"" and dominated the European Touring Car Championship and wild German Deutsche Rennsport Meisterschaft…","Staying cool, calm, and collected is easier said than done. With a variety of high-performance CBD products, evn can help simplify the process. The company offers a range of various formulas, includi… [+618 chars]",Very Positive,100,['wild'],"['German', 'European']","['European', 'Driving', 'Deutsche', 'Meisterschaft', 'Touring', 'BMWs', 'the', 'Rennsport', 'The', 'Car', 'Championship', 'Machine', 'German', 'Ultimate']",2023-03-16T23:00:00Z,https://uncrate.com/barn-find-1972-bmw-30-cs/,https://uncrate.com/p/2023/03/barn-find-bmw-cs-1.jpg
79,Uncrate.com,Uncrate,BMW CE 04 Vagabund Moto Concept,BMW's R nineT and R18 aren't the only canvases awaiting bike builders. Austria's Vagabund Moto CE 04 e-scooter as a base for a custom urban commuter with a healthy dose of style. The earth-tone paint scheme is complimented by functional...,"Between overly-processed brown kibble, canned mystery meat, and a long list of unpronounceable ingredients on labels, finding food that's actually good for your dogs can be challenging. Nom Nom makes… [+671 chars]",Very Negative,190,[],[],"['R18', 'BMWs']",2023-03-02T16:00:00Z,https://uncrate.com/bmw-ce-04-vagabund-moto-concept/,https://uncrate.com/p/2023/03/bmw-ce-04-vagabund-1.jpg
80,Core77.com,Rain Noe,BMW's Panoramic Vision Feature: Does This Really Qualify as a HUD?,"A heads-up display, or HUD, is one of the more useful features I've encountered in modern cars. So I was excited when BMW announced their forthcoming Panoramic Vision feature, which they touted as a ""New head-up display across the entire width of the windscre…","A heads-up display, or HUD, is one of the more useful features I've encountered in modern cars. So I was excited when BMW announced their forthcoming Panoramic Vision feature, which they touted as a … [+1190 chars]",Very Positive,10,['touted'],[],"['BMW', 'Vision', 'HUD']",2023-03-21T14:00:00Z,https://www.core77.com/posts/121538/BMWs-Panoramic-Vision-Feature-Does-This-Really-Qualify-as-a-HUD,https://s3files.core77.com/blog/images/lead_n_spotlight/1376056_lead_400_121538_.jpg
81,Theregister.com,Laura Dobberstein,"No 'decoupling' here: Apple, Samsung, and Qualcomm sing China's praises","First big government expo since COVID sees CEOs galore jet in
Some of Big Tech's top execs have sung China's praises at the 2023 China Development Forum – an annual government-organized event that returned from its COVID hiatus over the weekend.…","Some of Big Tech's top execs have sung China's praises at the 2023 China Development Forum an annual government-organized event that returned from its COVID hiatus over the weekend.
Attendees includ… [+3069 chars]",Very Positive,0,[],[],"['Chinas', 'COVID']",2023-03-27T05:37:58Z,https://www.theregister.com/2023/03/27/china_development_forum/,https://regmedia.co.uk/2022/01/27/china_shutterstock3.jpg
82,MakeUseOf,Rajesh Pandey,Google Pixel March 2023 Feature Drop: 5 New Features Coming to Your Phone,Even older Pixel phones are gaining some useful new features in the March Feature Drop.,Google rolls out quarterly Feature Drops for its Pixel phones with several additions and enhancements alongside the usual security and bug fixes. The March 2023 Feature Drop contains some notable new… [+3578 chars],Very Negative,190,[],[],['Pixel'],2023-03-14T13:50:16Z,https://www.makeuseof.com/pixel-feature-drop-march-2023-new-features/,https://static1.makeuseofimages.com/wordpress/wp-content/uploads/2023/03/charge-other-devices-using-a-pixel-smartphone.jpg
83,MakeUseOf,Geoff Piehl,Every Electric Vehicle That Qualifies for US Tax Credit in 2023,"If you want to ensure that your EV purchase is eligible for the clean vehicle tax credit, we've rounded up all qualifying vehicles.","If you live in the US and buy a new electric vehicle (EV) or plug-in hybrid electric vehicle (PHEV) in 2023, you might be eligible for a federal tax credit of up to $7,500. While the credit existed p… [+10384 chars]",Very Positive,0,[],[],['EV'],2023-03-01T15:00:17Z,https://www.makeuseof.com/electric-vehicles-eligible-tax-credit/,https://static1.makeuseofimages.com/wordpress/wp-content/uploads/2022/03/ev-charging-cable-plug.jpg
84,Phandroid - News for Android,Mike Viray,"Sorry Tesla, the Volkswagen ID. 2all is the Affordable EV Everyone’s been Waiting For","If Tesla continues to hold back on the ""affordable"" EV segment, we just might see a new EV champion in the next few years.","Electric Vehicles (EVs for short) have seen a significant rise in popularity over the past few years, due to a variety of different factors including rising fuel costs, integration of convenient smar… [+4247 chars]",Neutral,0,[],[],"['Tesla', 'EV']",2023-03-20T17:21:25Z,https://phandroid.com/2023/03/20/sorry-tesla-the-volkswagen-id-2all-is-the-affordable-ev-everyones-been-waiting-for/,nan
85,Jalopnik,Owen Bellwood,BMW's M Division Will Work its Magic on the All-Electric 5-Series,"For 45 years, the BMW M car has been the go-to for anyone wanting a fun but practical daily driver. Now, as the world prepares to switch to a battery-powered future, the M division has yet to show its full hand. But that might be about to change, as BMW has c…","For 45 years, the BMW M car has been the go-to for anyone wanting a fun but practical daily driver. Now, as the world prepares to switch to a battery-powered future, the M division has yet to show it… [+2664 chars]",Very Positive,0,[],[],"['BMW', 'M']",2023-03-16T16:40:00Z,https://jalopnik.com/bmw-m-will-make-a-performance-all-electric-5-series-1850232370,"https://i.kinja-img.com/gawker-media/image/upload/c_fill,f_auto,fl_progressive,g_center,h_675,pg_1,q_80,w_1200/51f5bd83d1d0f3fa7cda7936af3bd7c9.jpg"
86,Jalopnik,Rob Emslie,"At $5,200, Is This 1985 BMW 535i a Credible Classic?",The reason given for the sale of today’s Nice Price or No Dice BMW E28 is a lack of space following the purchase of a new truck. Let’s see if this old-school Bimmer is priced well enough for someone to start planning it a new space.Read more...,The reason given for the sale of todays Nice Price or No Dice BMW E28 is a lack of space following the purchase of a new truck. Lets see if this old-school Bimmer is priced well enough for someone to… [+3739 chars],Very Positive,10,['lack'],[],['Bimmer'],2023-03-06T14:00:00Z,https://jalopnik.com/at-5-200-is-this-1985-bmw-535i-a-credible-classic-1850183626,"https://i.kinja-img.com/gawker-media/image/upload/c_fill,f_auto,fl_progressive,g_center,h_675,pg_1,q_80,w_1200/45aced910551c338570c96d7ec88c958.jpg"
87,Jalopnik,Bob Sorokanich,America's Nasty Diesel Fuel Keeps Ruining Bosch Fuel Pumps,"The National Highway Traffic Safety Administration (NHTSA) is upgrading its ongoing investigation into a rash of failures of high-pressure fuel pumps affecting diesel-powered Ram, Jeep and BMW vehicles. Nearly 500,000 vehicles could be affected, and so far, t…","The National Highway Traffic Safety Administration (NHTSA) is upgrading its ongoing investigation into a rash of failures of high-pressure fuel pumps affecting diesel-powered Ram, Jeep and BMW vehicl… [+3233 chars]",Very Negative,240,"['failures', 'rash']",[],"['Traffic', 'BMW', 'Highway', 'Safety', 'Jeep', 'The', 'investigation', 'Ram', 'National', 'Administration']",2023-03-23T15:30:00Z,https://jalopnik.com/diesel-fuel-pump-failure-ram-jeep-bmw-bosch-nhtsa-probe-1850256303,"https://i.kinja-img.com/gawker-media/image/upload/c_fill,f_auto,fl_progressive,g_center,h_675,pg_1,q_80,w_1200/b5c5f633f6e49038a0e0cc3fc6b83b70.jpg"
88,Jalopnik,Collin Woodard,The Genesis GV70 Is Selling for 28 Percent Over MSRP,"If you’re in the market for a luxury crossover, the Genesis GV70 is a tempting choice. It’s ridiculously good-looking, can be had with a 375-hp V6, has a gorgeous cabin and comes with a 10-year powertrain warranty. With a base price below $45,000, it’s a barg…","If youre in the market for a luxury crossover, the Genesis GV70 is a tempting choice. Its ridiculously good-looking, can be had with a 375-hp V6, has a gorgeous cabin and comes with a 10-year powertr… [+1923 chars]",Very Negative,200,['ridiculously'],[],['Genesis'],2023-03-11T01:00:00Z,https://jalopnik.com/genesis-gv70-crossover-selling-28-percent-over-msrp-1850213396,"https://i.kinja-img.com/gawker-media/image/upload/c_fill,f_auto,fl_progressive,g_center,h_675,pg_1,q_80,w_1200/d6bcba3381728df10c50b3f1286482de.jpg"
89,Jalopnik,Lawrence Hodge,"The 2023 BMW M3 Is the Last Manual Car I’ll Ever Drive, And it's All My Knees' Fault","I’m sad to report that my manual driving days are over. I thought I could still hang, but nope, I can’t do it anymore. A combination of dealing with Osgood-Schlatter disease plus old football injuries means my knee cartilage is long past wearing thin. But wha…","Im sad to report that my manual driving days are over. I thought I could still hang, but nope, I cant do it anymore. A combination of dealing with Osgood-Schlatter disease plus old football injuries … [+3958 chars]",Very Negative,260,"['sad', 'hang']",['disease'],['OsgoodSchlatter'],2023-03-16T14:30:00Z,https://jalopnik.com/2023-bmw-m3-manual-bad-knees-cant-drive-stick-shift-1850182675,"https://i.kinja-img.com/gawker-media/image/upload/c_fill,f_auto,fl_progressive,g_center,h_675,pg_1,q_80,w_1200/c8478aec36e2c84a7dff6e49d94e6583.jpg"
