Index,Source,Author,Title,Description,Content,Headline Sentiment,Offense Rating,Negative Words,Offensive Words,Tags,publishedAt,url,urlToImage
90,Jalopnik,Erik Shilling,Tesla Is on Its Way to Being America's Luxury King Again,"The U.S. Department of Energy thinks that a Tesla Model 3 is a luxury sedan even if you and I don’t, classifying it as such on FuelEconomy.gov, and grouping it in with every other luxury marque you’ve heard of. Which means we also must accept a still new-ish …","The U.S. Department of Energy thinks that a Tesla Model 3 is a luxury sedan even if you and I dont, classifying it as such on FuelEconomy.gov, and grouping it in with every other luxury marque youve … [+2005 chars]",Very Positive,0,[],[],"['U.', 'of', 'Department', 'The', 'Energy', 'S.']",2023-03-15T21:30:00Z,https://jalopnik.com/tesla-is-on-its-way-to-being-americas-luxury-king-again-1850229720,"https://i.kinja-img.com/gawker-media/image/upload/c_fill,f_auto,fl_progressive,g_center,h_675,pg_1,q_80,w_1200/3419dc006c49c918faeb7f1f5ea45624.jpg"
91,Jalopnik,Elizabeth Blackstock,I Hit 170 MPH On the Back of a Motorcycle at COTA and it Dismantled My Perception of Life,"I’ve never so much as sat on a motorcycle in my entire life. It’s been over a decade since I rode a bicycle. So when MotoGP and the Circuit of the Americas asked if I’d be interested in doing “backpack laps,” riding on the back of a crotch-rocket while a prof…",Ive never so much as sat on a motorcycle in my entire life. Its been over a decade since I rode a bicycle. So when MotoGP and the Circuit of the Americas asked if Id be interested in doing backpack l… [+13197 chars],Very Positive,0,[],[],"['Americas', 'of', 'the', 'Circuit']",2023-03-09T19:00:00Z,https://jalopnik.com/bmw-s-1000-rr-backpack-laps-moto-gp-cota-1850206897,"https://i.kinja-img.com/gawker-media/image/upload/c_fill,f_auto,fl_progressive,g_center,h_675,pg_1,q_80,w_1200/1938f295a08a3b9a0f32d138969d2733.png"
92,Jalopnik,Kyle Hyatt,This Feral Engineer Is Building an Off-Road Rally Dodge Viper,"Safari-style car builds are super popular right now. You take a cool car, often a sports car, and then you lift it by a couple of inches and toss some chunky tires and a roof basket on. Maybe some rally lights, too, if you’re feeling spicy. Of course, there’s…","Safari-style car builds are super popular right now. You take a cool car, often a sports car, and then you lift it by a couple of inches and toss some chunky tires and a roof basket on. Maybe some ra… [+1515 chars]",Very Positive,30,['chunky'],[],"['Safaristyle', 'right']",2023-03-10T15:00:00Z,https://jalopnik.com/this-feral-engineer-is-building-an-off-road-rally-dodge-1850211128,"https://i.kinja-img.com/gawker-media/image/upload/c_fill,f_auto,fl_progressive,g_center,h_675,pg_1,q_80,w_1200/40b4714912a246a75cf6e1447a498757.png"
93,Jalopnik,Rob Emslie,"At $15,500, Could This 2014 Honda Civic Si Make You Feel Civic-Minded?","The current Honda Civic Si is one of the best cars on the market today. It’s also hella expensive, which is why cars like today’s Nice Price or No Dice 2014 edition might look contrastingly appealing. Let’s see just how appealing this last-gen edition is.Read…","The current Honda Civic Si is one of the best cars on the market today. Its also hella expensive, which is why cars like todays Nice Price or No Dice 2014 edition might look contrastingly appealing. … [+3820 chars]",Very Negative,200,['expensive'],[],"['Honda', 'Civic', 'Si']",2023-03-07T14:00:00Z,https://jalopnik.com/at-15-500-is-this-2014-honda-civic-si-a-good-deal-1850192014,"https://i.kinja-img.com/gawker-media/image/upload/c_fill,f_auto,fl_progressive,g_center,h_675,pg_1,q_80,w_1200/02c0a398d3ed76e8502fa4c32e4afbf8.jpg"
94,Jalopnik,Kyle Hyatt,The 2023 Porsche 718 Cayman GTS 4.0 Is the Sports Car Platonic Ideal,"If you’ve read any of my work, you probably know that I’m Jalopnik’s biggest Porsche 911 fanboy. I love them. When everyone says, “Miata is always the answer,” I say nope and point to a 911 because it can do everything better – which it should, since it’s way…","If youve read anyof mywork, you probably know that Im Jalopniks biggest Porsche 911 fanboy. I love them. When everyone says, Miata is always the answer, I say nope and point to a 911 because it can d… [+7244 chars]",Very Positive,20,[],[],"['Jalopniks', 'answer', 'Miata']",2023-02-27T15:00:00Z,https://jalopnik.com/2023-porsche-718-cayman-gts-4-0-the-jalopnik-review-1850158359,"https://i.kinja-img.com/gawker-media/image/upload/c_fill,f_auto,fl_progressive,g_center,h_675,pg_1,q_80,w_1200/ec82738bcb6d6c0f39b913b84c53b624.jpg"
95,Jalopnik,Tom McParland,I Want to Replace My Old Boxster With Something More Modern! What Car Should I Buy?,"Jansen got an old Boxster on the cheap, and while the Porsche has given him a lot of smiles per dollar it’s starting to become more of a chore. He wants to replace it with something more up-to-date but still awesome enough to throw down some good lap times. W…","Jansen got an old Boxster on the cheap, and while the Porsche has given him a lot of smiles per dollar its starting to become more of a chore. He wants to replace it with something more up-to-date bu… [+6946 chars]",Very Positive,20,"['cheap', 'chore']",[],"['Jansen', 'Boxster', 'Porsche']",2023-03-09T18:30:00Z,https://jalopnik.com/i-want-to-replace-my-old-boxster-with-something-more-mo-1850206863,"https://i.kinja-img.com/gawker-media/image/upload/c_fill,f_auto,fl_progressive,g_center,h_675,pg_1,q_80,w_1200/72eddf0374050790e226b707aa682ead.jpg"
96,Jalopnik,Andy Kalmowitz,Buy This 27-Liter V12-Powered Shooting Brake and Feel Superior to Everybody,"Do you ever feel like your car is lacking? Lacking in power? Lacking in size? Lacking in engine displacement? Lacking in rarity? Well, here’s your chance to change all that. Auction site Car & Classic is getting ready to offer up the one –the only – The Beast…","Do you ever feel like your car is lacking? Lacking in power? Lacking in size? Lacking in engine displacement? Lacking in rarity? Well, heres your chance to change all that. Auction site Car &amp; Cla… [+2818 chars]",Very Positive,90,"['lacking', 'Lacking']",['Beast'],['Lacking'],2023-03-02T21:00:00Z,https://jalopnik.com/buy-this-27-liter-v12-powered-shooting-brake-and-feel-s-1850178909,"https://i.kinja-img.com/gawker-media/image/upload/c_fill,f_auto,fl_progressive,g_center,h_675,pg_1,q_80,w_1200/0338fa1e416fed9ea99a12fb6fcd58d6.jpg"
97,Jalopnik,Owen Bellwood,Volvo Isn’t Considering Locking the EX90’s Best Features Behind Subscriptions... Yet,"It’s a big year for Swedish automaker Volvo as it’s preparing to roll out its new flagship SUV, which for the first time will be all-electric. The EX90 was first unveiled at the end of 2022 and Volvo has been sharing more and more details about the new car ah…","Its a big year for Swedish automaker Volvo as its preparing to roll out its new flagship SUV, which for the first time will be all-electric. The EX90 was first unveiled at the end of 2022 and Volvo h… [+3353 chars]",Neutral,0,[],[],['Volvo'],2023-03-09T20:00:00Z,https://jalopnik.com/volvo-ex90-electric-luxury-suv-subscription-features-1850207983,"https://i.kinja-img.com/gawker-media/image/upload/c_fill,f_auto,fl_progressive,g_center,h_675,pg_1,q_80,w_1200/fa00c382098e52917764b5613012edf5.jpg"
98,Jalopnik,Rob Emslie,"At $16,500, Is This 1965 Chevy Corvair Monza Safely a Deal?","Chevy’s second take on the Corvair turned out to be one of the most stunning cars the ‘60s had to offer. Today’s Nice Price or No Dice Chevrolet Monza, adds some additional pizzazz. Will its price prove just as compelling?Read more...","Chevys second take on the Corvair turned out to be one of the most stunning cars the 60s had to offer. Todays Nice Price or No Dice Chevrolet Monza, adds some additional pizzazz. Will its price prove… [+4848 chars]",Very Positive,0,[],[],"['Corvair', 'Chevys']",2023-03-28T13:00:00Z,https://jalopnik.com/at-16-500-is-this-1965-chevy-corvair-safely-a-deal-1850268110,"https://i.kinja-img.com/gawker-media/image/upload/c_fill,f_auto,fl_progressive,g_center,h_675,pg_1,q_80,w_1200/215f60a67263889924041878a6f42ecd.jpg"
99,Jalopnik,Tim Stevens,America's Best Citroën Mechanic Wants You to Take Over His Shop,Dave Burnham is desperate to retire. One of America’s best Citroën mechanics and restorers — perhaps the best when it comes to the byzantine hydraulic systems used on models like the Traction Avant and the DS — Burnham has built his reputation through 40 year…,Dave Burnham is desperate to retire. One of Americas best Citroën mechanics and restorers perhaps the best when it comes to the byzantine hydraulic systems used on models like the Traction Avant and … [+9151 chars],Very Positive,20,"['desperate', 'byzantine']",[],"['Citron', 'the', 'Avant', 'Traction', 'Burnham', 'DS', 'Dave']",2023-03-27T13:30:00Z,https://jalopnik.com/dave-burnham-best-citroen-mechanic-giving-away-his-shop-1850241709,"https://i.kinja-img.com/gawker-media/image/upload/c_fill,f_auto,fl_progressive,g_center,h_675,pg_1,q_80,w_1200/047bbcce67b19cf6667f233ff5f40d55.jpg"
